{
  "version": "1.0.0",
  "generatedAt": "2026-02-12T00:00:00Z",
  "sourceOfTruth": "java-unitrie",
  "specs": [
    {
      "specId": "SPEC-TRIE-PUT-SPLIT-COALESCE-001",
      "specClass": "trie",
      "criticality": "consensus-critical",
      "javaSource": [
        {
          "file": "rskj-core/src/main/java/co/rsk/trie/Trie.java",
          "line": 438,
          "symbol": "put(byte[] key, byte[] value)"
        },
        {
          "file": "rskj-core/src/main/java/co/rsk/trie/Trie.java",
          "line": 827,
          "symbol": "internalPut"
        },
        {
          "file": "rskj-core/src/main/java/co/rsk/trie/Trie.java",
          "line": 915,
          "symbol": "split"
        }
      ],
      "javaBehavior": "Path-compressed binary trie mutation with exact split/coalesce transitions and deterministic root impact.",
      "rustTarget": [
        "legacy-v1",
        "next"
      ],
      "evidence": {
        "requiredTests": [
          "co.rsk.trie.TrieKeyValueTest",
          "co.rsk.trie.TrieDeleteTest",
          "co.rsk.trie.engine.rust.UnitrieDifferentialCorpusReplayTest"
        ],
        "requiredCorpus": [
          "rskj-core/src/test/resources/trie/differential/sample-parity-corpus.jsonl"
        ]
      },
      "status": "partial"
    },
    {
      "specId": "SPEC-TRIE-DELETE-RECURSIVE-PREFIX-001",
      "specClass": "trie",
      "criticality": "consensus-critical",
      "javaSource": [
        {
          "file": "rskj-core/src/main/java/co/rsk/trie/Trie.java",
          "line": 475,
          "symbol": "deleteRecursive(byte[] key)"
        }
      ],
      "javaBehavior": "Recursive deletion removes all keys under a prefix while preserving node canonicalization semantics.",
      "rustTarget": [
        "legacy-v1",
        "next"
      ],
      "evidence": {
        "requiredTests": [
          "co.rsk.trie.TrieDeleteTest",
          "co.rsk.trie.engine.rust.UnitrieDifferentialCorpusReplayTest"
        ],
        "requiredCorpus": [
          "rskj-core/src/test/resources/trie/differential/sample-parity-corpus.jsonl"
        ]
      },
      "status": "partial"
    },
    {
      "specId": "SPEC-TRIE-GET-FIND-001",
      "specClass": "trie",
      "criticality": "consensus-critical",
      "javaSource": [
        {
          "file": "rskj-core/src/main/java/co/rsk/trie/Trie.java",
          "line": 650,
          "symbol": "find(byte[] key)"
        },
        {
          "file": "rskj-core/src/main/java/co/rsk/trie/Trie.java",
          "line": 407,
          "symbol": "get(byte[] key)"
        }
      ],
      "javaBehavior": "Lookup semantics for key traversal and absent-key handling must match Java exactly.",
      "rustTarget": [
        "legacy-v1",
        "next"
      ],
      "evidence": {
        "requiredTests": [
          "co.rsk.trie.TrieKeyValueTest",
          "co.rsk.trie.engine.rust.UnitrieDifferentialCorpusReplayTest"
        ],
        "requiredCorpus": [
          "rskj-core/src/test/resources/trie/differential/sample-parity-corpus.jsonl"
        ]
      },
      "status": "implemented"
    },
    {
      "specId": "SPEC-TRIE-COLLECT-KEYS-ITERATION-001",
      "specClass": "trie",
      "criticality": "consensus-critical",
      "javaSource": [
        {
          "file": "rskj-core/src/main/java/co/rsk/trie/Trie.java",
          "line": 594,
          "symbol": "collectKeys(Set<ByteArrayWrapper>, TrieKeySlice, int)"
        },
        {
          "file": "rskj-core/src/main/java/co/rsk/trie/Trie.java",
          "line": 618,
          "symbol": "collectKeys(int byteSize)"
        }
      ],
      "javaBehavior": "Collect keys traversal must preserve deterministic ordering and key truncation behavior.",
      "rustTarget": [
        "legacy-v1",
        "next"
      ],
      "evidence": {
        "requiredTests": [
          "co.rsk.trie.TrieIteratorTest",
          "co.rsk.trie.engine.rust.UnitrieDifferentialCorpusReplayTest"
        ],
        "requiredCorpus": [
          "rskj-core/src/test/resources/trie/differential/sample-parity-corpus.jsonl"
        ]
      },
      "status": "implemented"
    },
    {
      "specId": "SPEC-TRIE-CHILDREN-SIZE-VARINT-001",
      "specClass": "trie",
      "criticality": "consensus-critical",
      "javaSource": [
        {
          "file": "rskj-core/src/main/java/co/rsk/trie/Trie.java",
          "line": 997,
          "symbol": "getChildrenSize()"
        },
        {
          "file": "rskj-core/src/main/java/co/rsk/trie/Trie.java",
          "line": 682,
          "symbol": "internalToMessage() childrenSize"
        }
      ],
      "javaBehavior": "Serialized children-size varint encoding must match Java for every node shape.",
      "rustTarget": [
        "legacy-v1",
        "next"
      ],
      "evidence": {
        "requiredTests": [
          "co.rsk.trie.TrieDTOTest",
          "co.rsk.trie.TrieStoreImplTest"
        ],
        "requiredCorpus": []
      },
      "status": "partial"
    },
    {
      "specId": "SPEC-TRIE-EMBEDDABLE-THRESHOLD-44-001",
      "specClass": "trie",
      "criticality": "consensus-critical",
      "javaSource": [
        {
          "file": "rskj-core/src/main/java/co/rsk/trie/Trie.java",
          "line": 68,
          "symbol": "MAX_EMBEDDED_NODE_SIZE_IN_BYTES"
        },
        {
          "file": "rskj-core/src/main/java/co/rsk/trie/Trie.java",
          "line": 588,
          "symbol": "isEmbeddable()"
        }
      ],
      "javaBehavior": "Node embeddability threshold is exactly 44 bytes and impacts persistence and hashing.",
      "rustTarget": [
        "legacy-v1",
        "next"
      ],
      "evidence": {
        "requiredTests": [
          "co.rsk.trie.TrieStoreImplTest",
          "co.rsk.trie.TrieSaveRetrieveTest"
        ],
        "requiredCorpus": []
      },
      "status": "partial"
    },
    {
      "specId": "SPEC-TRIE-VALUE-LENGTH-HASH-001",
      "specClass": "trie",
      "criticality": "consensus-critical",
      "javaSource": [
        {
          "file": "rskj-core/src/main/java/co/rsk/db/MutableTrieImpl.java",
          "line": 67,
          "symbol": "getValueLength(byte[] key)"
        },
        {
          "file": "rskj-core/src/main/java/co/rsk/db/MutableTrieImpl.java",
          "line": 78,
          "symbol": "getValueHash(byte[] key)"
        }
      ],
      "javaBehavior": "Value length and hash APIs must remain semantically identical for EVM-visible behavior.",
      "rustTarget": [
        "legacy-v1",
        "next"
      ],
      "evidence": {
        "requiredTests": [
          "co.rsk.trie.TrieValueTest",
          "co.rsk.trie.engine.rust.UnitrieDifferentialCorpusReplayTest"
        ],
        "requiredCorpus": [
          "rskj-core/src/test/resources/trie/differential/sample-parity-corpus.jsonl"
        ]
      },
      "status": "implemented"
    },
    {
      "specId": "SPEC-CODEC-RSKIP107-SERIALIZE-001",
      "specClass": "codec-rskip107",
      "criticality": "consensus-critical",
      "javaSource": [
        {
          "file": "rskj-core/src/main/java/co/rsk/trie/Trie.java",
          "line": 677,
          "symbol": "internalToMessage()"
        }
      ],
      "javaBehavior": "RSKIP107 serialization bytes for trie nodes are consensus-critical and must be stable.",
      "rustTarget": [
        "legacy-v1",
        "next"
      ],
      "evidence": {
        "requiredTests": [
          "co.rsk.trie.TrieStoreImplTest",
          "co.rsk.trie.TrieSaveRetrieveTest"
        ],
        "requiredCorpus": []
      },
      "status": "partial"
    },
    {
      "specId": "SPEC-CODEC-RSKIP107-DESERIALIZE-001",
      "specClass": "codec-rskip107",
      "criticality": "consensus-critical",
      "javaSource": [
        {
          "file": "rskj-core/src/main/java/co/rsk/trie/Trie.java",
          "line": 259,
          "symbol": "fromMessageRskip107(ByteBuffer message, TrieStore store)"
        }
      ],
      "javaBehavior": "RSKIP107 deserialization must reconstruct nodes/references without byte-level ambiguity.",
      "rustTarget": [
        "legacy-v1",
        "next"
      ],
      "evidence": {
        "requiredTests": [
          "co.rsk.trie.TrieStoreImplTest",
          "co.rsk.trie.TrieSaveRetrieveTest"
        ],
        "requiredCorpus": []
      },
      "status": "partial"
    },
    {
      "specId": "SPEC-CODEC-ORCHID-SERIALIZE-001",
      "specClass": "codec-orchid",
      "criticality": "consensus-critical",
      "javaSource": [
        {
          "file": "rskj-core/src/main/java/co/rsk/trie/Trie.java",
          "line": 525,
          "symbol": "toMessageOrchid(boolean isSecure)"
        }
      ],
      "javaBehavior": "Orchid serialization must remain compatible for pre-RSKIP107 stored states.",
      "rustTarget": [
        "legacy-v1",
        "next"
      ],
      "evidence": {
        "requiredTests": [
          "co.rsk.trie.TrieOrchidMessageTest",
          "co.rsk.trie.TrieSaveRetrieveTest"
        ],
        "requiredCorpus": []
      },
      "status": "partial"
    },
    {
      "specId": "SPEC-CODEC-ORCHID-DESERIALIZE-001",
      "specClass": "codec-orchid",
      "criticality": "consensus-critical",
      "javaSource": [
        {
          "file": "rskj-core/src/main/java/co/rsk/trie/Trie.java",
          "line": 177,
          "symbol": "fromMessageOrchid(byte[] message, TrieStore store)"
        }
      ],
      "javaBehavior": "Orchid deserialization must correctly hydrate persisted legacy nodes.",
      "rustTarget": [
        "legacy-v1",
        "next"
      ],
      "evidence": {
        "requiredTests": [
          "co.rsk.trie.TrieOrchidMessageTest",
          "co.rsk.trie.TrieSaveRetrieveTest"
        ],
        "requiredCorpus": []
      },
      "status": "partial"
    },
    {
      "specId": "SPEC-STORAGE-KEYS-RSKIP108-MAPPING-001",
      "specClass": "storage-keys",
      "criticality": "consensus-critical",
      "javaSource": [
        {